record_id,title,type_of_reference,authors,secondary_title,abstract,year,doi,volume,commu_AB,commu_RP,indiv_AB,indiv_RP,letha_ER,letha_ES,letha_NN,letha_RP,molec_AH,molec_AJ,molec_EA,popul_CB,popul_RP,subin_RP,subin_RT,asreview_prior,exported_notes_1,included,asreview_ranking
10,"Assessment of lethal and sublethal effects of imidacloprid, ethion, and glyphosate on aversive conditioning, motility, and lifespan in honey bees (Apis mellifera L.)",JOUR,"['Delkash-Roudsari, S.', 'Chicas-Mosier, A.M.', 'Goldansaz, S.H.', 'Talebi-Jahromi, K.', 'Ashouri, A.', 'Abramson, C.I.']",Ecotoxicology and Environmental Safety,"Honeybees (Apis mellifera) play an important role in agriculture worldwide. Several factors including agrochemicals can affect honey bee health including habitat fragmentation, pesticide application, and pests. The growing human population and subsequent increasing crop production have led to widespread use of agrochemicals and there is growing concern that pollinators are being negatively impacted by these pesticides. The present study compares acute exposure to imidacloprid (0.2 and 0.4 mgL−1), ethion (80 and 106.7 mgL−1) or glyphosate (0.12 and 0.24 mgL−1) on aversive learning and movement, to chronic exposure at these and higher concentrations on movement, circadian rhythms, and survival in honey bee foragers. For acute learning studies, a blue/yellow shuttle box experiment was conducted; we observed honey bee choice following aversive and neutral stimuli. In learning studies, control bees spent >50% of the time on yellow which is not consistent with previous color bias literature in the subspecies or region of the study. The learning apparatus was also used to estimate mobility effects within 20 min of exposure. Chronic exposure (up to 2 weeks) with the above metrics was recorded by an automated monitoring system. In chronic exposure experiments, RoundUp®, was also tested to compare to its active ingredient, glyphosate. We found that imidacloprid and ethion have negative impacts on aversive learning and movement following a single-dose and that chronic exposure effects were dose-dependent for these two insecticides. In contrast, glyphosate had no effect on learning and less of an effect on movement; RoundUp® showed dose-dependent results on circadian rhythmicity. Overall, the results suggest that short-term exposure to imidacloprid and ethion adversely affect honey bee foragers and chronic exposure to glyphosate may affect pollination success. © 2020 Elsevier Inc.",2020,10.1016/j.ecoenv.2020.111108,204,,0,0.0,,,,0.0,,,,,,0.0,0.0,,0,,1,29
74,Influence of honey bee seasonal phenotype and emerging conditions on diet behavior and susceptibility to imidacloprid,JOUR,"['Alburaki, M.', 'Madella, S.', 'Vu, P.', 'Corona, M.']",Apidologie,"Honey bee Apis mellifera L. colonies produce two distinct phenotypes of workers during summer and winter to cope with drastic seasonal variations in climate and food resources. Imidacloprid (IMP) is a neonicotinoid insecticide widely used in agriculture for pest management control. In this study, we investigate the influence of seasonal phenotype and emerging conditions on the diet behavior of bees fed ad libitum two concentrations of IMP. We performed three independent two-choice feeding experiments using summer bees either emerged in the laboratory or in-hive and winter bees. Diet behavior post-ingestive aversion responses to IMP were investigated as well as potential affinity to the physical location and contents of the diets. Caged bees were challenged with a physical rotation of the diet’s location and their susceptibility to 5 and 20 PPB of IMP was tested. From a behavioral standpoint, our results show that winter bees expressed no affinity to the physical location of the diet but rather to its content and strongly favored IMP-tainted syrup at both 5 and 20 PPB. The opposite was recorded for naïve summer bees that emerged in the laboratory, which avoided the tainted syrup at both concentrations, particularly at 20 PPB. Summer bees emerged in-hive, expected to have developed a mature intestinal microbiota through trophallaxis from older bee-mates, were mainly neutral, and showed no affinity to the diet location nor its contents. Our results indicate that the physiological changes associated with seasonal phenotype and initial exposure to older mates have important consequences on the bee diet behavior toward pesticides. © 2022, This is a U.S. government work and not under copyright protection in the U.S.; foreign copyright protection may apply.",2022,10.1007/s13592-022-00922-9,53,,0,0.0,,0.0,,,,,,,,0.0,,,0,,1,30
169,The miticide thymol in combination with trace levels of the neonicotinoid imidacloprid reduces visual learning performance in honey bees (Apis mellifera),JOUR,"['Colin, T.', 'Plath, J.A.', 'Klein, S.', 'Vine, P.', 'Devaud, J.-M.', 'Lihoreau, M.', 'Meikle, W.G.', 'Barron, A.B.']",Apidologie,"Despite growing concerns over the impacts of agricultural pesticides on honey bee health, miticides (a group of pesticides used within hives to kill bee parasites) have received little attention. We know very little about how miticides might affect bee cognition, particularly in interaction with other known stressors, such as crop insecticides. Visual learning is essential for foraging bees to find their way to flowers, recognize them, and fly back to the nest. Using a standardized aversive visual conditioning assay, we tested how field exposure to three pesticides affects visual learning in European honey bees (Apis mellifera). Our pesticides were two common miticides, thymol in the commercial formulation Apiguard® and tau-fluvalinate in the formulation Apistan® and one neonicotinoid, imidacloprid. We found no effect of miticides alone, nor of field-relevant doses of imidacloprid alone, but bees exposed to both thymol and imidacloprid showed reduced performance in the visual learning assay. © 2020, INRA, DIB and Springer-Verlag France SAS, part of Springer Nature.",2020,10.1007/s13592-020-00737-6,51,,0,0.0,,,,0.0,,,,,,0.0,0.0,,0,,1,31
15,Biopesticide-induced behavioral and morphological alterations in the stingless bee Melipona quadrifasciata,JOUR,"['Barbosa, WF', 'Tomé, HVV', 'Bernardes, RC', 'Siqueira, MAL', 'Smagghe, G', 'Guedes, RNC']",ENVIRONMENTAL TOXICOLOGY AND CHEMISTRY,"Because of their natural origin, biopesticides are assumed to be less harmful to beneficial insects, including bees, and therefore their use has been widely encouraged for crop protection. There is little evidence, however, to support this ingrained notion of biopesticide safety to pollinators. Because larval exposure is still largely unexplored in ecotoxicology and risk assessment on bees, an investigation was performed on the lethal and sublethal effects of a diet treated with 2 bioinsecticides, azadirachtin and spinosad, on the stingless bee, Melipona quadrifasciata, which is one of the most important pollinators in the Neotropics. Survival of stingless bee larvae was significantly compromised at doses above 210ng a.i./bee for azadirachtin and 114ng a.i./bee for spinosad. No sublethal effect was observed on larvae developmental time, but doses of both compounds negatively affected pupal body mass. Azadirachtin produced deformed pupae and adults as a result of its insect growth regulator properties, but spinosad was more harmful and produced greater numbers of deformed individuals. Only spinosad compromised walking activity of the adult workers at doses as low as 2.29ng a.i./bee, which is 1/5000 of the maximum field recommended rate. In conclusion, the results demonstrated that bioinsecticides can pose significant risks to native pollinators with lethal and sublethal effects; future investigations are needed on the likelihood of such effects under field conditions. Environ Toxicol Chem 2015;34:2149-2158. (c) 2015 SETAC",2015,10.1002/etc.3053,34,,0,0.0,,,,0.0,,,,,,0.0,0.0,0.0,0,,1,32
24,"Context-Dependent Effect of Dietary Phytochemicals on Honey Bees Exposed to a Pesticide, Thiamethoxam",JOUR,"['Seshadri, A.', 'Bernklau, E.']",Journal of Insect Science,"Honey bees continue to face challenges relating to the degradation of natural flowering habitats that limit their access to diverse floral resources. While it is known that nectar and pollen provide macronutrients, flowers also contain secondary metabolites (phytochemicals) that impart benefits including increased longevity, improved gut microbiome abundance, and pathogen tolerance. Our study aims to understand the role of phytochemicals in pesticide tolerance when worker bees were fed with sublethal doses (1 ppb and 10 ppb) of thiamethoxam (TMX), a neonicotinoid, in 20% (w/v) sugar solution supplemented with 25 ppm of phytochemicals - caffeine, kaempferol, gallic acid, or p-coumaric acid, previously shown to have beneficial impacts on bee health. The effect of phytochemical supplementation during pesticide exposure was context-dependent. With 1 ppb TMX, phytochemical supplementation increased longevity but at 10 ppb TMX, longevity was reduced suggesting a negative synergistic effect. Phytochemicals mixed with 1 ppb TMX increased mortality in bees of the forager-age group but with 10 ppb TMX, mortality of the inhive-age group increased, implying the possibility of accumulation effect in lower sublethal doses. Given that the phytochemical composition of pollen and nectar varies between plant species, we suggest that the negative impacts of agrochemicals on honey bees could vary based on the phytochemicals in pollen and nectar of that crop, and hence the effects may vary across crops. Analyzing the phytochemical composition for individual crops may be a necessary first step prior to determining the appropriate dosage of agrochemicals so that harm to bees Apis mellifera L. is minimized while crop pests are effectively controlled. © 2021 Published by Oxford University Press on behalf of Entomological Society of America 2021.",2021,10.1093/jisesa/ieab053,21,,0,0.0,,,,0.0,,,,,,0.0,0.0,,0,,1,33
46,"Effects, but no interactions, of ubiquitous pesticide and parasite stressors on honey bee (Apis mellifera) lifespan and behaviour in a colony environment",JOUR,"['Retschnig, G.', 'Williams, G.R.', 'Odemer, R.', 'Boltin, J.', 'Di Poto, C.', 'Mehmann, M.M.', 'Retschnig, P.', 'Winiger, P.', 'Rosenkranz, P.', 'Neumann, P.']",Environmental Microbiology,"Interactions between pesticides and parasites are believed to be responsible for increased mortality of honey bee (Apis mellifera) colonies in the northern hemisphere. Previous efforts have employed experimental approaches using small groups under laboratory conditions to investigate influence of these stressors on honey bee physiology and behaviour, although both the colony level and field conditions play a key role for eusocial honey bees. Here, we challenged honey bee workers under in vivo colony conditions with sublethal doses of the neonicotinoid thiacloprid, the miticide tau-fluvalinate and the endoparasite Nosema ceranae, to investigate potential effects on longevity and behaviour using observation hives. In contrast to previous laboratory studies, our results do not suggest interactions among stressors, but rather lone effects of pesticides and the parasite on mortality and behaviour, respectively. These effects appear to be weak due to different outcomes at the two study sites, thereby suggesting that the role of thiacloprid, tau-fluvalinate and N.ceranae and interactions among them may have been overemphasized. In the future, investigations into the effects of honey bee stressors should prioritize the use of colonies maintained under a variety of environmental conditions in order to obtain more biologically relevant data. © 2015 Society for Applied Microbiology and John Wiley & Sons Ltd.",2015,10.1111/1462-2920.12825,17,0.0,0,0.0,,,0.0,,,0.0,0.0,0.0,,0.0,,,0,,1,34
127,Residual effect of imidacloprid and beta-cyfluthrin on Africanized Apis mellifera L. (Hymenoptera: Apidae) workers,JOUR,"['Abati, R.', 'Libardoni, G.', 'Osowski, G.', 'de Souza Vismara, E.', 'Costa-Maia, F.M.', 'Lozano, E.R.', 'Adami, P.F.', 'Potrich, M.']",Apidologie,"Canola has a long period of flowering in the winter season and this, associated with the lack of other flowers and the use of insecticides to control insect pests, means it may have a great impact on bee populations, such as Apis mellifera L. (Hymenoptera: Apidae). In this context, the use of insecticides with lower residuals and less harmful effects to bees is fundamental. Thus, the objective of the current work was to evaluate, in a laboratory bioassay, the residual toxicity and effect of imidacloprid, beta-cyfluthrin, and a mixture of both, when applied on canola in the field, on Africanized A. mellifera workers. Three commercial products were applied, formulated with imidacloprid, beta-cyfluthrin, and beta-cyfluthrin + imidacloprid. Each plot received one of the three treatments, in the concentration recommended by the manufacturer, at intervals between 14 and 0 days prior to conducting the bioassays. On the day of the bioassay, the bees were exposed to the plant material containing the treatments for a period of two hours, and were transferred to PVC cages, containing food and water. Mortality assessments were then performed at pre-established intervals until a 96 h post-exposure. Residuals on canola leaves of all tested products caused a significant reduction of honeybee worker longevity, which was less accentuated when the interval after treatment application increased. Safer pest management strategies are needed to ensure the preservation of bees. © 2023, INRAE, DIB and Springer-Verlag France SAS, part of Springer Nature.",2023,10.1007/s13592-023-01005-z,54,,0,0.0,,,,0.0,,,,,,0.0,0.0,,0,,1,35
88,Many-fold less than the field recommended concentrations of neonicotinoids and malathion affect foraging of honeybee in three important crops in India,JOUR,"['Olotu, M.I.', 'Gujar, G.T.']",Entomon,"Although insecticides effectively control the insect pests in different agro-ecosystems, they also reportedly affect the non-target insects including bee pollinators at the sub-lethal concentrations. A series of field experiments were conducted to evaluate the effects of two neonicotinoids and one organophosphate insecticide on the foraging activity of honeybee in three test crops at the sub-lethal concentration during flowering. The mean number of the dwarf honeybee (DHB), Apis florea (F.) (Hymenoptera: Apidae) recorded during the pre-spraying did not differ between treatments on each of the three crops. However, it differed significantly during the post-spraying except for malathion on inflorescences of the pearl millet. The DHB foraging time remained generally constant during the pre-spraying and varied greatly during the post-spraying on the three test crops and both groups of insecticides. The neonicotinoids and malathion significantly reduced visits of the DHB on the inflorescences of the test crops, their foraging activities and time spent on the inflorescences at the concentration many-fold (5-50 fold) less than the field recommended concentration of the insecticide. © 2016 Association for Advancement of Entomology. © 2016 Association for Advancement of Entomology.",2016,,41,,0,0.0,,0.0,,,,,,,,0.0,,,0,,1,36
146,Sub-lethal doses of clothianidin inhibit the conditioning and biosensory abilities of the western honeybee apis mellifera,JOUR,"['Bartling, M.T.', 'Vilcinskas, A.', 'Lee, K.-Z.']",Insects,"Insects play an important role in the stability of ecosystems by fulfilling key functions such as pollination and nutrient cycling, as well as acting as prey for amphibians, reptiles, birds and mammals. The global decline of insects is therefore a cause for concern, and the role of chemical pesticides must be examined carefully. The lethal effects of insecticides are well understood, but sub-lethal concentrations have not been studied in sufficient detail. We therefore used the western honeybee Apis mellifera as a model to test the effect of the neonicotinoid insecticide clothianidin on the movement, biosensory abilities and odor-dependent conditioning of insects, titrating from lethal to sub-lethal doses. Bees treated with sub-lethal doses showed no significant movement impairment compared to untreated control bees, but their ability to react to an aversive stimulus was inhibited. These results show that clothianidin is not only highly toxic to honeybees, but can, at lower doses, also disrupt the biosensory capabilities of survivors, probably reducing fitness at the individual level. In our study, sub-lethal doses of clothianidin altered the biosensory abilities of the honeybee; possible consequences at the colony level are discussed. © 2019 by the authors.",2019,10.3390/insects10100340,10,,0,0.0,,0.0,,,,,,,,0.0,0.0,,0,,1,37
80,Is the Water Supply a Key Factor in Stingless Bees' Intoxication?,JOUR,"['Rosa-Fontana, A.D.S.', 'Dorigo, A.S.', 'Soares-Lima, H.M.', 'Nocelli, R.C.F.', 'Malaspina, O.']",Journal of Insect Science,"Water is an important resource for stingless bees, serving for both honey dilution and the composition of larval food inside nests, yet can be an important route of exposure to pesticides. Assuming bees can forage naturally on pesticide-contaminated or noncontaminated areas, we investigated whether water supply influences the choice between neonicotinoid-dosed or nondosed feeders and on mortality of the stingless bee, Melipona scutellaris (Latreille, Hymenoptera, Apidae). At the field concentration, there was no significant mortality; however, the bees were not able to distinguish the feeders. In the cages containing high-concentration feeders, with water supply, the bees preferred nondosed food, and with no water, the mortality increased. Considering that in the field it is common to find extrapolated concentrations, our work suggested that water may allow avoidance of high dosed food and minimize mortality.  © 2020 The Author(s) 2020. Published by Oxford University Press on behalf of Entomological Society of America.",2021,10.1093/jisesa/ieaa127,20,,0,,0.0,0.0,,,,,,,,,,,0,,1,38
107,No effect of dual exposure to sulfoxaflor and a trypanosome parasite on bumblebee olfactory learning,JOUR,"['Vaughan, OP', 'Straw, EA', 'Linguadoca, A', 'Brown, MJF']",SCIENTIFIC REPORTS,"Bees are important pollinators in wild and agricultural ecosystems, and understanding the factors driving their global declines is key to maintaining these pollination services. Learning, which has been a focus of previous ecotoxicological studies in bees, may play a key role in driving colony fitness. Here we move beyond the standard single-stressor approach to ask how multiple stressors, an agrochemical (sulfoxaflor, a relatively new insecticide) and a parasite (Crithidia bombi, a prevalent gut parasite of bumblebees), impact learning in the bumblebee Bombus terrestris. We developed a modified version of the classic proboscis extension reflex assay to assess the combined effects of acute oral sulfoxaflor exposure and infection by C. bombi on olfactory learning of bumblebee workers. We found no evidence that either sulfoxaflor, C. bombi, or their combination had any significant effect on bumblebee olfactory learning, despite their known negative impacts on other aspects of bumblebee health. This suggests that losses in cognitive ability, as measured here, are unlikely to explain the impacts of sulfoxaflor and its interactions with other stressors on bumblebees. Our novel methodology provides a model system within which to test interactive effects of other key stressors on bee health.",2022,10.1038/s41598-022-12714-3,12,,0,0.0,,,0.0,,,,,,,0.0,,,0,,1,39
128,Residual toxicity of selected insecticides on Aphis gossypii and their safety limits on honeybees,JOUR,"['Khamis, W.M.', 'Abdel-Hameed, K.M.A.', 'El-Sabrout, A.M.']",Acta Phytopathologica et Entomologica Hungarica,"Evaluation studies were carried out to simulate realistic field exposures of sulfoxaflor and flonicamid against Aphis gossypii at foraging time of Apis mellifera. Semi-field trials of field rates of sulfoxaflor and flonicamid against A. gossypii laboratory strain at 48 h of exposure had equipollent overall mean of mortality of 62.50 and 63.50%, respectively in season of 2020, likewise 60.50 and 62.50%, respectively in season of 2021. Lethal time values (LT1) had ranges of 51.33–32.46 days for sulfoxaflor and 49.00–39.55 days for flonicamid. Laboratory trials on foraging honeybees (∼21 days old) at 5 h of exposure showed an excellence for sulfoxaflor (5.00%) in overall mean of mortality compared to flonicamid (2.75%) in season of 2020. Likewise, sulfoxaflor (4.75%) surpassed flonicamid (2.75%) in season of 2021. The highest LT1s on honeybees for sulfoxaflor and flonicamid reached 27.45 and 10.94 days, respectively. International Organization for Biological Control classified both insecticides to be harmless on honeybees. Survival foraging bees exposed to LD50s of the tested insecticides had malformed digestive tracts gradually vanished along week of exposure. Suggestions for foliar spray stoppages prior to flowering period were mentioned for both insecticides. © 2021 Akadémiai Kiadó, Budapest",2021,10.1556/038.2021.00127,56,,0,0.0,,0.0,,,,,,,,0.0,,,0,,1,40
32,Effect of sub-lethal doses of thiamethoxam on the memory of Apis mellifera Linnaeus,JOUR,"['Karedla, A.K.', 'Choudhary, A.', 'Singh, J.', 'Chhuneja, P.K.']",Current Science,"Honey bees forage owing to their remarkable ability to learn and memorize their cues. The effect of thiame-thoxam on the memory of bees was studied through the proboscis extension reflex (PER). The bees that consu-med higher doses of thiamethoxam (0.93–5.76 ng bee–1) showed lesser sensitivity to sucrose than those that con-sumed lower doses (0.03–0.64 ng bee–1). Bees sensitivity was least affected at the highest sucrose concentration (50% w/v). PER in trained and treated bees recorded after 2 and 24 h of consuming the various doses of thia-methoxam showed a significant reduction in memory (13.3–82.2% and 0.00–68.9% respectively). Field-level studies are required to validate the results and formulate strategies at the national level for safeguarding the bees © 2023,Current Science. All Rights Reserved.",2023,10.18520/cs/v124/i4/451-456,124,,0,0.0,,0.0,,,,,,,,0.0,0.0,,0,,1,41
43,Effects of sublethal doses of thiacloprid and its formulation Calypso® on the learning and memory performance of honey bees,JOUR,"['Tison, L.', 'Holtz, S.', 'Adeoye, A.', 'Kalkan, Ö.', 'Irmisch, N.S.', 'Lehmann, N.', 'Menzel, R.']",Journal of Experimental Biology,"Learning and memory play a central role in the behavior and communication of foraging bees. We have previously shown that chronic uptake of the neonicotinoid thiacloprid affects the behavior of honey bees in the field. Foraging behavior, homing success, navigation performance and social communication were impaired. Thiacloprid collected at a feeding site at low doses accumulates in foragers over time. Here, we applied a laboratory standard procedure (the proboscis-extension response conditioning) in order to assess which processes, acquisition, memory consolidation and/or memory retrieval were compromised after bees were fed either with thiacloprid or the formulation of thiacloprid named Calypso® at different sublethal doses. Extinction and generalization tests allowed us to investigate whether bees respond to a learned stimulus, and how selectively. We showed that thiacloprid, as active substance and as formulation, poses a substantial risk to honey bees by disrupting learning and memory functions. These data support and specify the data collected in the field. © 2017, Company of Biologists Ltd. All rights reserved.",2017,10.1242/jeb.154518,220,,0,,,,,,,,0.0,,,,,,0,,1,42
