record_id,title,type_of_reference,authors,secondary_title,abstract,year,doi,volume,commu_AB,commu_RP,indiv_AB,indiv_RP,letha_ER,letha_ES,letha_NN,letha_RP,molec_AH,molec_AJ,molec_EA,popul_CB,popul_RP,subin_RP,subin_RT,asreview_prior,exported_notes_1,included,asreview_ranking
159,The Response of the Honey Bee Gut Microbiota to Nosema ceranae Is Modulated by the Probiotic Pediococcus acidilactici and the Neonicotinoid Thiamethoxam,JOUR,"['Sbaghdi, T.', 'Garneau, J.R.', 'Yersin, S.', 'Chaucheyras-Durand, F.', 'Bocquet, M.', 'Moné, A.', 'El Alaoui, H.', 'Bulet, P.', 'Blot, N.', 'Delbac, F.']",Microorganisms,"The honey bee Apis mellifera is exposed to a variety of biotic and abiotic stressors, such as the highly prevalent microsporidian parasite Nosema (Vairimorpha) ceranae and neonicotinoid insecticides. Both can affect honey bee physiology and microbial gut communities, eventually reducing its lifespan. They can also have a combined effect on the insect’s survival. The use of bacterial probiotics has been proposed to improve honey bee health, but their beneficial effect remains an open question. In the present study, western honey bees were experimentally infected with N. ceranae spores, chronically exposed to the neonicotinoid thiamethoxam, and/or supplied daily with the homofermentative bacterium Pediococcus acidilactici MA18/5M thought to improve the honey bees’ tolerance to the parasite. Deep shotgun metagenomic sequencing allowed the response of the gut microbiota to be investigated with a taxonomic resolution at the species level. All treatments induced significant changes in honey bee gut bacterial communities. Nosema ceranae infection increased the abundance of Proteus mirabilis, Frischella perrara, and Gilliamella apicola and reduced the abundance of Bifidobacterium asteroides, Fructobacillus fructosus, and Lactobacillus spp. Supplementation with P. acidilactici overturned some of these alterations, bringing back the abundance of some altered species close to the relative abundance found in the controls. Surprisingly, the exposure to thiamethoxam also restored the relative abundance of some species modulated by N. ceranae. This study shows that stressors and probiotics may have an antagonistic impact on honey bee gut bacterial communities and that P. acidilactici may have a protective effect against the dysbiosis induced by an infection with N. ceranae. © 2024 by the authors.",2024,10.3390/microorganisms12010192,12,,0,,0.0,,0.0,0.0,,,0.0,0.0,,,,,0,,1,57
68,Imidacloprid increases the prevalence of the intestinal parasite Lotmaria passim in honey bee workers,JOUR,"['Erban, T.', 'Parizkova, K.', 'Sopko, B.', 'Talacko, P.', 'Markovic, M.', 'Jarosova, J.', 'Votypka, J.']",Science of the Total Environment,"A challenge in bee protection is to assess the risks of pesticide-pathogen interactions. Lotmaria passim, a ubiquitous unicellular parasite in honey bees, is considered harmful under specific conditions. Imidacloprid causes unpredictable side effects. Research indicates that both L. passim and imidacloprid may affect the physiology, behavior, immunity, microbiome and lifespan of honey bees. We designed cage experiments to test whether the infection of L. passim is affected by a sublethal dose of imidacloprid. Workers collected at the time of emergence were exposed to L. passim and 2.5 μg/L imidacloprid in the coexposure treatment group. First, samples of bees were taken from cages since they were 5 days old and 3 days postinfection, i.e., after finishing an artificial 24 h L. passim infection. Additional bees were collected every two additional days. In addition, bees frozen at the time of emergence and collected from the unexposed group were analyzed. Abdomens were analyzed using qPCR to determine parasite load, while corresponding selected heads were subjected to a label-free proteomic analysis. Our results show that bees are free of L. passim at the time of emergence. Furthermore, imidacloprid considerably increased the prevalence as well as parasite loads in individual bees. This means that imidacloprid facilitates infection, enabling faster parasite spread in a colony and potentially to surrounding colonies. The proteomic analysis of bee heads showed that imidacloprid neutralized the increased transferrin 1 expression by L. passim. Importantly, this promising marker has been previously observed to be upregulated by infections, including gut parasites. This study contributes to understanding the side effects of imidacloprid and demonstrates that a single xenobiotic/pesticide compound can interact with the gut parasite. Our methodology can be used to assess the effects of different compounds on L. passim. © 2023 The Author(s)",2023,10.1016/j.scitotenv.2023.166973,905,,0,0.0,,0.0,,,,,,,,0.0,,,0,,1,58
99,Neonicotinoid-induced impairment of odour coding in the honeybee,JOUR,"['Andrione, M', 'Vallortigara, G', 'Antolini, R', 'Haase, A']",SCIENTIFIC REPORTS,"Exposure to neonicotinoid pesticides is considered one of the possible causes of honeybee (Apis mellifera) population decline. At sublethal doses, these chemicals have been shown to negatively affect a number of behaviours, including performance of olfactory learning and memory, due to their interference with acetylcholine signalling in the mushroom bodies. Here we provide evidence that neonicotinoids can affect odour coding upstream of the mushroom bodies, in the first odour processing centres of the honeybee brain, i.e. the antennal lobes (ALs). In particular, we investigated the effects of imidacloprid, the most common neonicotinoid, in the AL glomeruli via in vivo two-photon calcium imaging combined with pulsed odour stimulation. Following acute imidacloprid treatment, odour-evoked calcium response amplitude in single glomeruli decreases, and at the network level the representations of different odours are no longer separated. This demonstrates that, under neonicotinoid influence, olfactory information might reach the mushroom bodies in a form that is already incorrect. Thus, some of the impairments in olfactory learning and memory caused by neonicotinoids could, in fact, arise from the disruption in odor coding and olfactory discrimination ability of the honey bees.",2016,10.1038/srep38110,6,,0,0.0,,,,0.0,0.0,,0.0,0.0,,0.0,0.0,,0,,1,59
105,Neonicotinoids override a parasite exposure impact onhibernation success of a key bumblebee pollinator,JOUR,"['Fauser, A', 'Sandrock, C', 'Neumann, P', 'Sadd, B']",ECOLOGICAL ENTOMOLOGY,"1. Seasonal adaptations enabling the bridging of periodic challenging abiotic conditions are taxonomically widespread. However, sensitivity to other environmental stresses can be heightened during these periods. 2. Several temperate insects with over-wintering strategies play key ecosystem and economic roles, including wild bee pollinators. For example, hibernation survival in temperate bumblebees is crucial, as only new queens of future social colonies over-winter. These bees are also faced with other abiotic and biotic stressors, some of which have been linked to recent pollinator declines, such as exposure to pesticides and parasites. 3. Using a fully crossed experiment, the influence of dietary exposure to neonicotinoid insecticides (thiamethoxam and clothianidin) and/or the prevalent bumblebee parasite Crithidia bombi on hibernation survival and hibernation weight change of Bombus terrestris bumblebee queens was investigated. 4. Both neonicotinoid and C. bombi exposures reduced hibernation success individually, but no additive or synergistic effects between the stressors were found. Further, effects were asynchronous, with early neonicotinoid effects on hibernation mortality overriding later parasite effects under combined exposures. Neonicotinoid exposure also increased hibernation weight loss of surviving queens. 5. Diapause periods, employed by numerous temperate organisms, are likely to be especially vulnerable to environmental stresses, besides the seasonal challenge for which these periods are an adaptation. Thus, diapause requires inclusion during the consideration of the impacts of such stresses. Accordingly, it is demonstrated here that naturally relevant exposures of pesticides and parasites have important detrimental effects on bumblebees during a critical hibernation period, with potential consequences for populations of these key wild pollinators.",2017,10.1111/een.12385,42,,0,0.0,,0.0,,,,,,,,0.0,,,0,,1,60
170,The neonicotinoid imidacloprid alone alters the cognitive behavior in Apis mellifera L. and the combined exposure of imidacloprid and Varroa destructor mites synergistically contributes to trial attrition,JOUR,"['Schwartz, K.R.', 'Minor, H.', 'Magro, C.', 'McConnell, J.', 'Capani, J.', 'Griffin, J.', 'Doebel, H.']",Journal of Apicultural Research,"Honey bee (Apis mellifera L.) populations have undergone a dramatic decline as an outcome of an increasing incidence of colony collapse disorder (CCD). The honey bee is a unique keystone species because its pollination activities are not only necessary for the viability of many flowering plant species in the wild, but are also necessary for many human agricultural practices. The increasing prevalence of CCD is a threat to the economic and nutritional security of all societies that rely on efficient pollination for large monoculture crops. Although there is ample evidence that Varroa mites, pesticides, disease, and climate change contribute to CCD, only a few studies have investigated the contribution of synergism across multiple factors to the development of CCD and CCD-like symptoms. However, there is increasing acknowledgement in the scientific community that synergism across different factors affects honey bee colony health and behavior. Here, we provide evidence that sub-lethal levels of imidacloprid neonicotinoid pesticide reduce learning and memory capabilities. Synergistic effects become apparent when Varroa mites together with imidacloprid exposure to individual bees more than doubled average mortality and attrition per trial. © 2021 International Bee Research Association.",2020,10.1080/00218839.2020.1866233,60,,0,0.0,,0.0,,0.0,,,,,,0.0,,,0,,1,61
69,Imidacloprid reduces the mating success of males in bumblebees,JOUR,"['Chen, X', 'Wang, YH', 'Zhou, Y', 'Wang, FR', 'Wang, J', 'Yao, XD', 'Imran, M', 'Luo, SD']",SCIENCE OF THE TOTAL ENVIRONMENT,"Bumblebees play a vital role in both natural and agricultural environments, but there has been a noticeable decline in their populations. Pesticides, particularly neonicotinoids, are widely regarded as a substantial contributing factor to the decline in bumblebee populations, as evidenced by the detrimental impacts documented across many stages of their life cycle. Mating is vital for the population maintenance of bumblebees. Nevertheless, there is a scarcity of research conducted on the effects of pesticides on the mating process. In this study, we individually examined the impact of imidacloprid on the mating behavior of bumblebee males and queens. A competitive mating experiment was conducted to evaluate the effect on the competitive prowess of male individuals and the mate selection behavior of female individuals. The study revealed that the mating rate of bumblebees exposed to a concentration of 10 ppb of imidacloprid was 3 %. This finding demonstrated a statistically significant impact when compared to the control group, which exhibited a mating rate of 58 % in the normal mating experiment. Furthermore, in the competitive mating experiment, we found that the competitive mating success rate of treated males (1 %) was significantly lower than that of untreated males (35 %). Hence, it provides evidence that neonicotinoid imidacloprid negatively affects bumblebee mating success and cautions us to protect bumblebees from pesticide exposure to prevent a severe impact on their populations.",2024,10.1016/j.scitotenv.2024.172525,928,,0,0.0,,0.0,,,,,,,,0.0,0.0,,0,,1,62
148,"Sublethal acetamiprid exposure induces immunity, suppresses pathways linked to juvenile hormone synthesis in queens and affects cycle-related signaling in emerging bees",JOUR,"['Erban, T.', 'Markovic, M.', 'Sopko, B.']",Environmental Pollution,"Acetamiprid is the only neonicotinoid registered in the European Union because the risks of neonicotinoids to honey bees and other pollinators are strictly regulated. Herein, we orally exposed honey bee colonies to sublethal concentrations of acetamiprid (20 μg/L) under isolated conditions. After one month of continuous exposure, the emerging bees and queens were collected and analyzed via high-throughput label-free quantitative proteomics using a data-independent acquisition strategy. Six and 34 significantly differentially expressed proteins (DEPs) were identified in the emerging bees and queens, respectively. Mrjp3 was the only DEP found in both sample types/castes, and its opposite regulation illustrated a differential response. The DEPs in the emerging bees (H/ACA RNP, Rap1GAP, Mrjp3, and JHE) suggested that sublethal exposure to acetamiprid affected cell cycle-related signaling, which may affect the life history of workers in the colony. The DEPs with increased levels in queens, such as Mrjps 1–4 and 6–7, hymenoptaecin, and apidaecin 22, indicated an activated immune response. Additionally, the level of farnesyl pyrophosphate synthase (FPPS), which is essential for the mevalonate pathway and juvenile hormone biosynthesis, was significantly decreased in queens. The impaired utilization of juvenile hormone in queens supported the identification of additional DEPs. Furthermore, the proteome changes suggested the existence of increased neonicotinoid detoxification by UDP-glucuronosyltransferase and increased amino acid metabolism. The results suggest that the continuous exposure of bee colonies to acetamiprid at low doses (nanograms per gram in feed) may pose a threat to the colonies. The different exposure routes and durations for the emerging bees and queens in our experiment must be considered, i.e., the emerging bees were exposed as larvae via feeding royal jelly and beebread provided by workers (nurse bees), whereas the queens were fed royal jelly throughout the experiment. The biological consequences of the proteomic changes resulting from sublethal/chronic exposure require future determination. © 2024 Elsevier Ltd",2024,10.1016/j.envpol.2024.123901,349,,0,0.0,,,,0.0,,0.0,0.0,0.0,,0.0,,,0,,1,63
67,Imidacloprid and acetamiprid synergistically downregulate spaetzle and myD88 of the Toll pathway in haemocytes of the European honeybee (Apis mellifera),JOUR,"['Malladi, S.', 'Sukkar, D.', 'Bonnefoy, A.', 'Falla-Angel, J.', 'Laval-Gilly, P.']",Environmental Toxicology and Pharmacology,"Pollinator health has been of critical concern over the last few decades. The prevalence of the honeybee Colony Collapse Disorder (CCD), changing climate, and the rise of vector-borne honeybee diseases by Varroa destructor, have played a major role in the rapid decline of global honeybee populations. Honeybees are environmentally and economically significant actors in biodiversity. The impact of agricultural practices, such as pesticide use, has exacerbated the negative effects on honeybees. We demonstrate the synergistic effect of cocktails of the neonicotinoids imidacloprid and acetamiprid on honeybee haemocytes. Two genes responsible for critical immune responses, spaetzle and myD88, are consistently dysregulated following exposure to either neonicotinoid alone or as a mixture with or without an immune challenge. The 2018 ban of neonicotinoids in Europe, followed by the 2020 reauthorisation of imidacloprid in France and the current consideration to reinstate acetamiprid underscores the need to evaluate their cumulative impact on honeybee health. © 2023 Elsevier B.V.",2023,10.1016/j.etap.2023.104323,104,,0,,0.0,0.0,,0.0,,0.0,,0.0,,,,,0,,1,64
117,Pollinators and plant nurseries: How irrigation and pesticide treatment of native ornamental plants impact solitary bees,JOUR,"['Cecala, J.M.', 'Wilson Rankin, E.E.']",Proceedings of the Royal Society B: Biological Sciences,"A key conservation goal in agroecosystems is to understand how management practices may affect beneficial species, such as pollinators. Currently, broad gaps exist in our knowledge as to how horticultural management practices, such as irrigation level, might influence bee reproduction, particularly for solitary bees. Despite the extensive use of ornamental plants by bees, especially little is known about how irrigation level may interact with insecticides, like water-soluble neonicotinoids, to influence floral rewards and bee reproduction. We designed a two-factor field cage experiment in which we reared Megachile rotundata (Fabricius) (Hymenoptera: Megachilidae) on containerized ornamental plants grown under two different irrigation levels and imidacloprid treatments (30% label rate dosage of a nursery formulation or an untreated control). Lower irrigation was associated with modest decreases in nectar volume and floral abundance in untreated plants, whereas irrigation did not affect plants treated with imidacloprid. Furthermore, higher irrigation decreased the amount of imidacloprid entering nectar. Imidacloprid application strongly reduced bee foraging activity and reproduction, and higher irrigation did not offset any negative effects on bees. Our study emphasizes the impact of a nursery neonicotinoid formulation on solitary bee foraging and reproduction, while highlighting interactions between irrigation level and neonicotinoid application in containerized plants themselves.  © 2021 The Authors.",2021,10.1098/rspb.2021.1287,288,,0,0.0,,0.0,,,0.0,,0.0,,,0.0,0.0,,0,,1,65
174,The weakest link: Haploid honey bees are more susceptible to neonicotinoid insecticides,JOUR,"['Friedli, A', 'Williams, GR', 'Bruckner, S', 'Neumann, P', 'Straub, L']",CHEMOSPHERE,"Neonicotinoid insecticides are currently of major concern for the health of wild and managed insects that provide key ecosystem services like pollination. Even though sublethal effects of neonicotinoids are well known, there is surprisingly little information on how they possibly impact developmental stability, and to what extent genetics are involved. This holds especially true for haploid individuals because they are hemizygous at detoxification loci and may be more susceptible. Here we take advantage of haplodiploidy in Western honey bees, Apis mellifera, to show for the first time that neonicotinoids affect developmental stability in diploid females (workers), and that haploid males (drones) are even more susceptible. Phenotypic fore wing venation abnormalities and fluctuating wing asymmetry, as measures of developmental instability, were significantly increased under field-realistic neonicotinoid-exposure of colonies. The higher susceptibility of haploid drones suggests that heterozygosity can play a key role in the ability to buffer the sublethal effects of neonicotinoids. Aiming to improve conservation efforts, our findings highlight the urgent need to better understand the role that genetics plays at enabling nontarget organisms to cope with insecticide exposure. (C) 2019 The Authors. Published by Elsevier Ltd.",2020,10.1016/j.chemosphere.2019.125145,242,,0,0.0,,0.0,,,0.0,,0.0,,,0.0,0.0,,0,,1,66
138,Selected Biochemical Markers Change after Oral Administration of Pesticide Mixtures in Honey Bees,JOUR,"['Migdal, P.', 'Murawska, A.', 'Berbeć, E.', 'Plotnik, M.', 'Skorus, A.', 'Latarowski, K.']",Toxics,"The honey bee is an important pollinator. In the environment, it can be exposed to many harmful factors, such as pesticides. Nowadays, attention is paid to evaluating the potentially harmful effects of these substances. This study aimed to evaluate the effect of worst-case environmental concentrations of pesticide mixtures on honey bee survival and selected physiological markers (the activity of ALT, AST, ALP, and GGTP, and the concentration of albumin, creatinine, urea, and uric acid). Pesticides of three different groups (insecticide—acetamiprid, herbicide—glyphosate, and fungicide—tebuconazole) and their mixtures were resolved in 50% (w/v) sucrose solution and given to bees ad libitum. After 24 h, hemolymph was collected. All mixtures caused higher mortality than single pesticides. Pesticides in mixtures caused disturbances in biochemical markers, and in some cases the interaction between pesticides was synergistic. The mixtures had individual effects on physiology, and the results were sensitive to changes in proportions. © 2022 by the authors.",2022,10.3390/toxics10100590,10,,0,,0.0,0.0,,0.0,,0.0,0.0,0.0,,,,,0,,1,67
84,"Lethal effects of various tank mixtures including insecticides, fungicides and fertilizers on honey bees under laboratory, semi-field and field conditions",JOUR,"['Wernecke, A.', 'Frommberger, M.', 'Forster, R.', 'Pistorius, J.']",Journal fur Verbraucherschutz und Lebensmittelsicherheit,"In agricultural crops, honey bees may be exposed to multiple pesticides. However, in field realistic conditions mixtures of products classified as harmless to bees can lead to a synergistic increase of toxicity on honey bees, as known for ergosterol biosynthesis-inhibiting (EBI) fungicides combined with pyrethroids or neonicotinoids. For substances like fertilizers, usually no information on potential side effects on bees is available. Initially, effects from tank mixes containing insecticides, fungicides and fertilizers were investigated under laboratory conditions by use of a spray chamber contact test. For selected combinations, higher tier studies were carried out. Mixtures containing thiacloprid, boscalid and dimoxystrobin with boron fertilizers showed no increase of mortality. In contrast, tank mixes of thiacloprid formulations and EBI-fungicides resulted within 24 h in synergistic mortality increase in laboratory, semi-field and field. Actually, a short time interval of 24 h between individually applied potentially synergistic products like pyrethroid insecticides and EBI fungicides led to an increase of mortality up to 100% under laboratory conditions, indicating that the detoxification was still ongoing, resulting in an increased susceptibility for other stressors during the metabolization process. In conclusion, tank mixtures do not always lead to an increase of honey bee toxicity. However, former published findings about synergistic impacts between neonicotinoides and EBI-fungicides could be confirmed. The findings of our and other higher tier studies finally prompted the competent regulatory authority (BVL) to regulate these mixtures by restriction NB6613 since September 2018. Nevertheless, the investigation of potential interactions between mixing partners and their additive or synergistic effects are the basis for a better understanding and a logical risk assessment to ensure protection of honey bees. © 2019, The Author(s).",2019,10.1007/s00003-019-01233-5,14,,0,0.0,,,,0.0,,,0.0,0.0,,0.0,,,0,,1,68
26,"Delayed and time-cumulative toxicity of imidacloprid in bees, ants and termites",JOUR,"['Rondeau, G.', 'Sánchez-Bayo, F.', 'Tennekes, H.A.', 'Decourtye, A.', 'Ramírez-Romero, R.', 'Desneux, N.']",Scientific Reports,"Imidacloprid, one of the most commonly used insecticides, is highly toxic to bees and other beneficial insects. The regulatory challenge to determine safe levels of residual pesticides can benefit from information about the time-dependent toxicity of this chemical. Using published toxicity data for imidacloprid for several insect species, we construct time-to-lethal-effect toxicity plots and fit temporal power-law scaling curves to the data. The level of toxic exposure that results in 50% mortality after time t is found to scale as t 1.7 for ants, from t 1.6 to t 5 for honeybees, and from t 1.46 to t 2.9 for termites. We present a simple toxicological model that can explain t 2 scaling. Extrapolating the toxicity scaling for honeybees to the lifespan of winter bees suggests that imidacloprid in honey at 0.25 μ ... 1/4g/kg would be lethal to a large proportion of bees nearing the end of their life.",2014,10.1038/srep05566,4,,0,0.0,,0.0,,,,,,,,0.0,,,0,,1,69
166,The influence of acetamiprid and deltamethrin on the mortality and behaviour of honeybees (Apis mellifera carnica Pollman) in oilseed rape cultivations,JOUR,"['Dworzańska, D.', 'Moores, G.', 'Zamojska, J.', 'Strażyński, P.', 'Węgorek, P.']",Apidologie,"The aim of the research was to determine the influence of acetamiprid and deltamethrin on the mortality and behaviour of honeybees of the same variety, coming from the same source and estimated to be in good condition by a professional beekeeper, but in different years and under different weather conditions. Results of research conducted in field isolators in oilseed rape fields in the years 2012–2018 showed no acetamiprid influence either on the mortality or on the behaviour of honeybees. Deltamethrin activity differed from a lack of influence through causing mortality and a weaker condition of honeybee colonies to the destruction of the colony. This demonstrates the relative safety of acetamiprid to honeybees and the high risk of deltamethrin use. The differences in the bee colonies’ reaction to deltamethrin are probably caused by the high acute toxicity of this active ingredient, genetically dependent, variable metabolic capabilities of particular bee colonies, or coexistence of a variety of different stressors—mainly pathogens. © 2020, The Author(s).",2020,10.1007/s13592-020-00792-z,51,,0,,0.0,,,0.0,,0.0,,,,,,,0,,1,70
